[
  {
    "capability_slug": "allocation",
    "maturity": "crawl",
    "official": false,
    "ordinal": 1,
    "parse_quality": "itemized",
    "text": "Simple Allocation strategy where costs of accounts, projects or subscriptions are allocated to the business units, portfolios or cost centers using a list of accounts known to belong to specific cost centers or business units"
  },
  {
    "capability_slug": "allocation",
    "maturity": "crawl",
    "official": false,
    "ordinal": 2,
    "parse_quality": "itemized",
    "text": "Tagging strategy exists including"
  },
  {
    "capability_slug": "allocation",
    "maturity": "crawl",
    "official": false,
    "ordinal": 3,
    "parent_ordinal": 2,
    "parse_quality": "itemized",
    "text": "resource naming standards"
  },
  {
    "capability_slug": "allocation",
    "maturity": "crawl",
    "official": false,
    "ordinal": 4,
    "parent_ordinal": 2,
    "parse_quality": "itemized",
    "text": "Account, Project, Subscription naming standards"
  },
  {
    "capability_slug": "allocation",
    "maturity": "crawl",
    "official": false,
    "ordinal": 5,
    "parse_quality": "itemized",
    "text": "Tagging strategy compliance is inconsistent"
  },
  {
    "capability_slug": "allocation",
    "maturity": "crawl",
    "official": false,
    "ordinal": 6,
    "parse_quality": "itemized",
    "text": "Monthly challenges identifying the owners of unknown, untagged, unidentified accounts"
  },
  {
    "capability_slug": "allocation",
    "maturity": "crawl",
    "official": false,
    "ordinal": 7,
    "parse_quality": "itemized",
    "text": "A significant portion of total costs can often be allocated directly without needing any adjustments or enhancements to the underlying metadata."
  },
  {
    "capability_slug": "allocation",
    "maturity": "crawl",
    "official": false,
    "ordinal": 8,
    "parse_quality": "itemized",
    "text": "Tags or labels are used for some allocation, but cannot be used consistently, or not used for a majority of spend"
  },
  {
    "capability_slug": "allocation",
    "maturity": "crawl",
    "official": false,
    "ordinal": 9,
    "parse_quality": "itemized",
    "text": "Shared costs are not identified beyond common charges such as support, tax, etc."
  },
  {
    "capability_slug": "allocation",
    "maturity": "crawl",
    "official": false,
    "ordinal": 10,
    "parse_quality": "itemized",
    "text": "Shared costs are allocated to central budgets or platform teams directly and not charged back to cost centers or business units"
  },
  {
    "capability_slug": "allocation",
    "maturity": "crawl",
    "official": false,
    "ordinal": 11,
    "parse_quality": "itemized",
    "text": "Product and Engineering Personas primarily manage to direct costs only, resulting in reduction in accuracy of forecasting and budgets"
  },
  {
    "capability_slug": "allocation",
    "maturity": "crawl",
    "official": false,
    "ordinal": 12,
    "parse_quality": "itemized",
    "text": "Basic KPIs for Cost ALlocation are defined and manually created on an inconsistent cadence"
  },
  {
    "capability_slug": "allocation",
    "maturity": "crawl",
    "official": false,
    "ordinal": 13,
    "parse_quality": "itemized",
    "text": "Allocation tasks are primarily managed with data provider systems and tooling"
  },
  {
    "capability_slug": "allocation",
    "maturity": "walk",
    "official": false,
    "ordinal": 1,
    "parse_quality": "itemized",
    "text": "Well-documented Allocation strategy identifying multiple mechanisms for allocating cost has been implemented but may not be used consistently or universally"
  },
  {
    "capability_slug": "allocation",
    "maturity": "walk",
    "official": false,
    "ordinal": 2,
    "parse_quality": "itemized",
    "text": "Infrequent investigation to identify unallocated, untagged, or unidentified cost elements"
  },
  {
    "capability_slug": "allocation",
    "maturity": "walk",
    "official": false,
    "ordinal": 3,
    "parse_quality": "itemized",
    "text": "A majority of total costs can often be allocated directly without needing any adjustments or enhancements to the underlying metadata."
  },
  {
    "capability_slug": "allocation",
    "maturity": "walk",
    "official": false,
    "ordinal": 4,
    "parse_quality": "itemized",
    "text": "Cost allocation can be done to an application or service level"
  },
  {
    "capability_slug": "allocation",
    "maturity": "walk",
    "official": false,
    "ordinal": 5,
    "parse_quality": "itemized",
    "text": "Tagging strategy for resources and hierarchy groupings is well-documented and followed"
  },
  {
    "capability_slug": "allocation",
    "maturity": "walk",
    "official": false,
    "ordinal": 6,
    "parse_quality": "itemized",
    "text": "Tagging compliance is consistent in key areas or applications but not universal"
  },
  {
    "capability_slug": "allocation",
    "maturity": "walk",
    "official": false,
    "ordinal": 7,
    "parse_quality": "itemized",
    "text": "Allocation mechanisms will typically include a combination of factors, such as accounts, projects or subscriptions which are identified by metadata or naming standard as belonging to specific cost centers, resources within shared cost pools which can be identified as belonging to a particular cost center, and some mechanisms for the distribution of shared costs"
  },
  {
    "capability_slug": "allocation",
    "maturity": "walk",
    "official": false,
    "ordinal": 8,
    "parse_quality": "itemized",
    "text": "Legacy or less critical parts of the technology infrastructure which are not consistently using the allocation standards still exist and require some manual or estimation effort"
  },
  {
    "capability_slug": "allocation",
    "maturity": "walk",
    "official": false,
    "ordinal": 9,
    "parse_quality": "itemized",
    "text": "Shared cost strategy is well documented and understood for multiple elements of shared cost"
  },
  {
    "capability_slug": "allocation",
    "maturity": "walk",
    "official": false,
    "ordinal": 10,
    "parse_quality": "itemized",
    "text": "Shared costs are split using an appropriate distribution model(s) (proportional, fixed, even-split) across the entirety of the organization"
  },
  {
    "capability_slug": "allocation",
    "maturity": "walk",
    "official": false,
    "ordinal": 11,
    "parse_quality": "itemized",
    "text": "Use of a combination of data provider and technology service provider tools, third party, or custom tooling to manage allocation and sharing"
  },
  {
    "capability_slug": "allocation",
    "maturity": "walk",
    "official": false,
    "ordinal": 12,
    "parse_quality": "itemized",
    "text": "Discounts are spread proportionally across all teams technology spend"
  },
  {
    "capability_slug": "allocation",
    "maturity": "walk",
    "official": false,
    "ordinal": 13,
    "parse_quality": "itemized",
    "text": "KPIs for cost allocation understood, but not automated"
  },
  {
    "capability_slug": "allocation",
    "maturity": "walk",
    "official": false,
    "ordinal": 14,
    "parse_quality": "itemized",
    "text": "Shared platform owners are able to showback costs generated by internal customers"
  },
  {
    "capability_slug": "allocation",
    "maturity": "walk",
    "official": false,
    "ordinal": 15,
    "parse_quality": "itemized",
    "text": "Product and Engineering Personas are aware of their portion of shared platform/service costs and include these costs when forecasting and budgeting"
  },
  {
    "capability_slug": "allocation",
    "maturity": "walk",
    "official": false,
    "ordinal": 16,
    "parse_quality": "itemized",
    "text": "Shared cost process documented to enable and manage expectations of “fair share” onboarding of new cost centers/business units"
  },
  {
    "capability_slug": "allocation",
    "maturity": "run",
    "official": false,
    "ordinal": 1,
    "parse_quality": "itemized",
    "text": "Costs are allocated at any level of granularity required by the organization"
  },
  {
    "capability_slug": "allocation",
    "maturity": "run",
    "official": false,
    "ordinal": 2,
    "parse_quality": "itemized",
    "text": "Direct allocation or consistent mechanisms for distributing shared cost items, and strategies for metadata, hierarchy and naming standards are being used consistently and effectively universally"
  },
  {
    "capability_slug": "allocation",
    "maturity": "run",
    "official": false,
    "ordinal": 3,
    "parse_quality": "itemized",
    "text": "Advanced practices reach consistently high levels of allocation coverage"
  },
  {
    "capability_slug": "allocation",
    "maturity": "run",
    "official": false,
    "ordinal": 4,
    "parse_quality": "itemized",
    "text": "Automation allows for multiple sources of data to be used to allocate shared costs at the level they can be where important to the organization (e.g. using metering tools to capture usage and augment billing data to attribute shared costs with greater accuracy)"
  },
  {
    "capability_slug": "allocation",
    "maturity": "run",
    "official": false,
    "ordinal": 5,
    "parse_quality": "itemized",
    "text": "There are few scenarios where all cost is not allocated at the most granular level or is unidentified, requiring essentially no research or reporting generation time"
  },
  {
    "capability_slug": "allocation",
    "maturity": "run",
    "official": false,
    "ordinal": 6,
    "parse_quality": "itemized",
    "text": "Use of technology/data provider tools, third party tools, custom tools integrated consistently"
  },
  {
    "capability_slug": "allocation",
    "maturity": "run",
    "official": false,
    "ordinal": 7,
    "parse_quality": "itemized",
    "text": "Employing automation in the provisioning of resources to create consistency of resource and account tagging and metadata"
  },
  {